{"schema":"ferrodoc-external-evidence-pin/1","source_pdf_sha256":"0e4aaa30ecd1edcd092fdeee1efd21ae446a36f95a696fb0baec0ee28db60f91","document_state_id":"state_483fa064abe04770ed6d0b230c961409e0ceb77bcc25298812722d112ccddfbf","evidence_ids":["evidence_75fd023eed55ff16eeb429b408fe7f149fa6ecf250a8d971cfacbad63fa2d1f5","evidence_895904d8c6cabd518976ae25959019121838b4ea74e239e79876f1e1ea79827e"]}
